ID	Epoch Day	Weekday	Date	When	Event	Tag
id=illuminati-2071	19725	Fri 1 January 1954	01/01/1954	1954 AD.	Hunt involved in CIA overthrow of communist regime in Guatemala, Carlos Castillo-Armas becomes president.	#illuminati
id=illuminati-2074	19725	Fri 1 January 1954	01/01/1954	1954 AD.	Richard Bissell joins the CIA.	#illuminati
id=illuminati-2077	19725	Fri 1 January 1954	01/01/1954	1954 AD.	Russian KGB created to replace earlier secret police.	#illuminati
id=illuminati-2080	19725	Fri 1 January 1954	01/01/1954	1954 AD.	Strange voice 'from space' speaks from turned-off radios in mid-west U.S. and London, warns against preparations for war.	#illuminati
id=illuminati-2083	20090	Sat 1 January 1955	01/01/1955	1955 AD.	Assassination of Jose Antonio Remon of Panama and Adnan Al-Malki of Syria.	#illuminati
id=illuminati-2086	20090	Sat 1 January 1955	01/01/1955	1955 AD.	Bilderberger meeting in Barbizon, France.	#illuminati
id=illuminati-2089	20090	Sat 1 January 1955	01/01/1955	1955 AD.	Doug Durham joins the Marines.	#illuminati
id=illuminati-2092	20090	Sat 1 January 1955	01/01/1955	1955 AD.	Lee Harvey Oswald meets David Ferrie of the New Orleans Civil Air Patrol.	#illuminati
id=illuminati-2095	20090	Sat 1 January 1955	01/01/1955	1955 AD.	The Office of Naval Research allegedly receives a copy of Morris Jessup's The Case for the UFOs with marginal notes in three different hands, supposedly by 'Gypsies' knowledgeable in UFOlogy; ONR reprints several hundred copies for internal use; an MIB called 'Carlos Allende' is implicated in the affair.	#illuminati
id=illuminati-2098	20455	Sun 1 January 1956	01/01/1956	1956 AD.	Assassination of Anastasio Somoza of Nicaragua.	#illuminati
id=illuminati-2101	20455	Sun 1 January 1956	01/01/1956	1956 AD.	Bilderberger meeting in Frednsborg, Denmark.	#illuminati
id=illuminati-2104	20455	Sun 1 January 1956	01/01/1956	1956 AD.	Clay Shaw's CIA contact allegedly stopped.	#illuminati
id=illuminati-2107	20455	Sun 1 January 1956	01/01/1956	1956 AD.	Durham receives special CIA training.	#illuminati
id=illuminati-2110	20455	Sun 1 January 1956	01/01/1956	1956 AD.	Oswald joins Marines.	#illuminati
id=illuminati-2113	20455	Sun 1 January 1956	01/01/1956	1956 AD.	UFOlogist Gray Barker publishes 'They Knew Too Much About Flying Saucers' which reported numerous MIB incidents.	#illuminati
id=illuminati-2116	20821	Tue 1 January 1957	01/01/1957	1957 AD.	Alleged assassination of Joseph McCarthy at Bethesda Hospital Neurological Ward, after warning of Illuminati plot.	#illuminati
id=illuminati-2119	20821	Tue 1 January 1957	01/01/1957	1957 AD.	Anti-atomic bomb propaganda disseminated by saucer clubs - another CIA plot?	#illuminati
id=illuminati-2122	20821	Tue 1 January 1957	01/01/1957	1957 AD.	Assassination of Carlos Castillo-Armas of Guatemala.	#illuminati
id=illuminati-2125	20821	Tue 1 January 1957	01/01/1957	1957 AD.	Bilderberger meetings in St. Simon Island, Georgia, and Fiuggui, Italy.	#illuminati
id=illuminati-2128	20821	Tue 1 January 1957	01/01/1957	1957 AD.	CIA helps Iran form SAVAK, secret police later accused of assassination Iranian dissidents.	#illuminati
id=illuminati-2131	20821	Tue 1 January 1957	01/01/1957	1957 AD.	Exiled Ukrainian politician Lev Rebet assassinated by KGB agent in Munich.	#illuminati
id=illuminati-2134	20821	Tue 1 January 1957	01/01/1957	1957 AD.	Experiments in behaviour modification sleep-teaching take place at California penal institution Woodland Road Camp.	#illuminati
id=illuminati-2137	20821	Tue 1 January 1957	01/01/1957	1957 AD.	Fourth UFO flap year.	#illuminati
id=illuminati-2140	20821	Tue 1 January 1957	01/01/1957	1957 AD.	General Edwin Walker commands federal troops sent to enforce racial integration at Little Rock, Arkansas.	#illuminati
id=illuminati-2143	20821	Tue 1 January 1957	01/01/1957	1957 AD.	Oswald assigned to base at Atsugi, Japan, where CIA U-2 planes were launched; shoots self in elbow.	#illuminati
id=illuminati-2146	20821	Tue 1 January 1957	01/01/1957	1957 AD.	Unexplained short wave radio signals received worldwide.	#illuminati
id=illuminati-2149	21186	Wed 1 January 1958	01/01/1958	1958 AD.	Assassination of Abdul Llah, Faisal II and Nuri Al-Said of Iraq.	#illuminati
id=illuminati-2152	21186	Wed 1 January 1958	01/01/1958	1958 AD.	Bilderberger meeting in Buxton, England.	#illuminati
id=illuminati-2155	21186	Wed 1 January 1958	01/01/1958	1958 AD.	Francis Gary Powers released from Air Force and assigned to covert CIA spying.	#illuminati
id=illuminati-2158	21186	Wed 1 January 1958	01/01/1958	1958 AD.	Ham radio operators pick up a male voice claiming to be Nacoma of Jupiter and warning of atomic bomb disaster in English, German, Norwegian and his own unknown language.	#illuminati
id=illuminati-2161	21186	Wed 1 January 1958	01/01/1958	1958 AD.	John Birch Society organized by Robert Welch.	#illuminati
id=illuminati-2164	21186	Wed 1 January 1958	01/01/1958	1958 AD.	Kerry Thornley and Gregory Hill found Discordianism and publish Principia Discordia, or How I Found Goddess and What I Did To Her When I Found Her; Thornley joins Marine Corps.	#illuminati
id=illuminati-2167	21186	Wed 1 January 1958	01/01/1958	1958 AD.	Nelson Rockefeller elected governor of New York.	#illuminati
id=illuminati-2170	21186	Wed 1 January 1958	01/01/1958	1958 AD.	Oswald on manoeuvres  in the Philippines involving U-2 flights.	#illuminati
id=illuminati-2173	21186	Wed 1 January 1958	01/01/1958	1958 AD.	Russia launches first space satellites.	#illuminati
id=illuminati-2176	21186	Wed 1 January 1958	01/01/1958	1958 AD.	Unidentified ex-Marine lives in Minsk, USSR, apparently gathering information for the CIA.	#illuminati
id=illuminati-2179	21551	Thu 1 January 1959	01/01/1959	1959 AD.	Apparent suicide of UFO researcher Morris Jessup who had received communications from 'Carlos Allende,' one of the MIB and whose book was mysteriously annotated by UFOlogical Gypsies.	#illuminati
id=illuminati-2182	21551	Thu 1 January 1959	01/01/1959	1959 AD.	Assassination of Solomon W.R. Bandaranaike of Ceylon.	#illuminati
id=illuminati-2185	21551	Thu 1 January 1959	01/01/1959	1959 AD.	Attempted assassination of Senator Bircher of Ohio and Governor Almond of Virginia.	#illuminati
id=illuminati-2188	21551	Thu 1 January 1959	01/01/1959	1959 AD.	Bilderberger meeting in Yesilkov, Turkey.	#illuminati
id=illuminati-2191	21551	Thu 1 January 1959	01/01/1959	1959 AD.	Condon's The Manchurian Candidate published.	#illuminati
id=illuminati-2194	21551	Thu 1 January 1959	01/01/1959	1959 AD.	Durham discharged from Marines, stationed at CIA base in Guatemala.	#illuminati
id=illuminati-2197	21551	Thu 1 January 1959	01/01/1959	1959 AD.	Exiled Ukrainian politician Stephan Bandera assassinated by KGB agent in Munich.	#illuminati
id=illuminati-2200	21551	Thu 1 January 1959	01/01/1959	1959 AD.	Fidel Castro assumes power in Cuba; Cuban Intelligence (DGI) begun.	#illuminati
id=illuminati-2203	21551	Thu 1 January 1959	01/01/1959	1959 AD.	Kerry Thornley first meets fellow Marine Oswald in California; Oswald released from Marines, defects to Russia.	#illuminati
id=illuminati-2206	21551	Thu 1 January 1959	01/01/1959	1959 AD.	Ruby visits casino owner in Havana.	#illuminati
id=illuminati-2209	21551	Thu 1 January 1959	01/01/1959	1959 AD.	Thornley assigned to U-2 base in Atsugi, Japan.	#illuminati
id=illuminati-2212	21551	Thu 1 January 1959	01/01/1959	1959 AD.	UFO sighting at CIA headquarters after Naval officer contacts 'space people' while in CIA-observed trance.	#illuminati
id=illuminati-2215	21916	Fri 1 January 1960	01/01/1960	1960 AD.	Assassination of Hazza Majali of Jordan.	#illuminati
id=illuminati-2218	21916	Fri 1 January 1960	01/01/1960	1960 AD.	Bernard Baker serves as conduit for Bay of Pigs funding.	#illuminati
id=illuminati-2221	21916	Fri 1 January 1960	01/01/1960	1960 AD.	Bilderberger meeting in Burgenstock, Switzerland.	#illuminati
id=illuminati-2224	21916	Fri 1 January 1960	01/01/1960	1960 AD.	CIA buys Southern Air Transport; contemplates development of 'recruitment pills' and other drugs; studies mysterious amnesia of Korean war prisoners moved through Manchuria; contemplates giving truth serum to brainwashed American POWs.	#illuminati
id=illuminati-2227	21916	Fri 1 January 1960	01/01/1960	1960 AD.	CIA spy Powers shot down in U-2 over Russia; summit conference cancelled.	#illuminati
id=illuminati-2230	21916	Fri 1 January 1960	01/01/1960	1960 AD.	Eisenhower authorizes training and arming Cuban exiles, allegedly issues orders for the assassination of Congolese leader Patrice Lumumba.	#illuminati
id=illuminati-2233	21916	Fri 1 January 1960	01/01/1960	1960 AD.	Kennedy-Nixon debates; Kennedy elected president.	#illuminati
id=illuminati-2236	21916	Fri 1 January 1960	01/01/1960	1960 AD.	Nixon, CIA agent Bissell and others plan Bay of Pigs invasion, obtain permission to use Guatemala as launching point.	#illuminati
id=illuminati-2239	21916	Fri 1 January 1960	01/01/1960	1960 AD.	Oswald assigned job in Belarusian Radio Factory in Minsk, USSR.	#illuminati
id=illuminati-2242	21916	Fri 1 January 1960	01/01/1960	1960 AD.	Project Ozma, searching for intelligent signals from another part of the universe, receives unexplained signals from space.	#illuminati
id=illuminati-2245	21916	Fri 1 January 1960	01/01/1960	1960 AD.	Thornley discharged from Marines.	#illuminati
id=illuminati-2248	22282	Sun 1 January 1961	01/01/1961	1961 AD.	Assassination of Lumumba of the Congo, Rafael Trujillo Molina of the Dominican Republic and Louis Rivagasore of Nurundi.	#illuminati
id=illuminati-2251	22282	Sun 1 January 1961	01/01/1961	1961 AD.	Attempted assassination of Castro by Hans Tanner.	#illuminati
id=illuminati-2254	22282	Sun 1 January 1961	01/01/1961	1961 AD.	Bilderberger meeting in Quebec, Canada.	#illuminati
id=illuminati-2257	22282	Sun 1 January 1961	01/01/1961	1961 AD.	Brooks introduces Thornley to his 'brother-in-law,' Gary Kirstein, allegedly an undercover E. Howard Hunt; Thornley and 'Kirstein' begin nearly three-year relationship of discussing Nazis, mind-control, the status of philosopher-kings, and plans to assassinate Kennedy.	#illuminati
id=illuminati-2260	22282	Sun 1 January 1961	01/01/1961	1961 AD.	Ferrie, Gordon Novel and two others arrested in burglary of Louisiana arms bunker.	#illuminati
id=illuminati-2263	22282	Sun 1 January 1961	01/01/1961	1961 AD.	General Walker resigns after criticism of his anti-communist indoctrination of troops.	#illuminati
id=illuminati-2266	22282	Sun 1 January 1961	01/01/1961	1961 AD.	George De Mohrenschildt on hiking trip through Guatemala.	#illuminati
id=illuminati-2269	22282	Sun 1 January 1961	01/01/1961	1961 AD.	Kennedy develops extracurricular relationship with Judith Campbell, Sam Giancana's girlfriend; Giancana and John Roselli enlisted by CIA to attempt Castro assassination.	#illuminati
id=illuminati-2272	22282	Sun 1 January 1961	01/01/1961	1961 AD.	Michael Rockefeller disappears in New Guinea.	#illuminati
id=illuminati-2275	22282	Sun 1 January 1961	01/01/1961	1961 AD.	Milgram's Yale experiments demonstrating dangers of obedience to authority.	#illuminati
id=illuminati-2278	22282	Sun 1 January 1961	01/01/1961	1961 AD.	Robert Morrow, working with Ruby, Shaw and Ferrie, allegedly smuggle weapons from Greece to Central America for the CIA; also picks up information for CIA from 'Harvey' in the Soviet Union.	#illuminati
id=illuminati-2281	22282	Sun 1 January 1961	01/01/1961	1961 AD.	Thornley arrives to New Orleans; Slim Brooks gives Thornley 'the haircut' on his 23rd birthday; the same day, the CIA invasion of Cuba at the Bay of Pigs, launched from Guatemala, fails due to poor planning and cancellation of support by Kennedy; the CIA, the Mob, Cuban-exiles, right-wingers and Nixonites supposedly vow revenge against Kennedy.	#illuminati
id=illuminati-2284	22282	Sun 1 January 1961	01/01/1961	1961 AD.	U.S. Military Advisor Group begins defoliation project (agent-Orange) in Vietnam which eventually covers over 12% of land area.	#illuminati
id=illuminati-2287	22282	Sun 1 January 1961	01/01/1961	1961 AD.	Unexplained transmissions from space monitored by ham radio operators worldwide; Bob Renaud, ham operator, allegedly makes contact with aliens.	#illuminati
id=illuminati-2290	22282	Sun 1 January 1961	01/01/1961	1961 AD.	Unidentified Marine from Minsk divulges information to CIA agent in Copenhagen.	#illuminati
id=illuminati-2293	22647	Mon 1 January 1962	01/01/1962	1962 AD.	Bilderberger meeting in Saltsjobaden, Sweden.	#illuminati
id=illuminati-2296	22647	Mon 1 January 1962	01/01/1962	1962 AD.	CIA allegedly pays a Canadian agriculture technician to infect Cuban turkeys with Newcastle disease (though the technician supposedly double-crossed them).	#illuminati
id=illuminati-2299	22647	Mon 1 January 1962	01/01/1962	1962 AD.	CIA begins using secret terror teams in Vietnam, roots of Operation Phoenix.	#illuminati
id=illuminati-2302	22647	Mon 1 January 1962	01/01/1962	1962 AD.	CIA interference in Ecuadorian politics.	#illuminati
id=illuminati-2305	22647	Mon 1 January 1962	01/01/1962	1962 AD.	Cuban missile crisis.	#illuminati
id=illuminati-2308	22647	Mon 1 January 1962	01/01/1962	1962 AD.	De Mohrenschildt, friend of the Kennedys, befriends the Oswalds in Dallas.	#illuminati
id=illuminati-2311	22647	Mon 1 January 1962	01/01/1962	1962 AD.	Dr. Edgar Schein outlines behaviour modification programs for U.S. prisons, based on Korean brainwashing techniques.	#illuminati
id=illuminati-2314	22647	Mon 1 January 1962	01/01/1962	1962 AD.	Durham employed by Des Moines Police Dept.	#illuminati
id=illuminati-2317	22647	Mon 1 January 1962	01/01/1962	1962 AD.	Film version of The Manchurian Candidate released.	#illuminati
id=illuminati-2320	22647	Mon 1 January 1962	01/01/1962	1962 AD.	Hunt becomes head of CIA's new Domestic Operations Division.	#illuminati
id=illuminati-2323	22647	Mon 1 January 1962	01/01/1962	1962 AD.	Lee Harvey Oswald returns to America with his Russian wife, Marina Nikolayevna Prusakova, an alleged KGB agent.	#illuminati
id=illuminati-2326	22647	Mon 1 January 1962	01/01/1962	1962 AD.	Retired General Walker arrested on Attorney Robert Kennedy's orders when Walker became involved in the racial disorders in Oxford, Mississippi; Walker stripped naked and flown to Springfield, Missouri, prison for examination; Walker reported to be incompetent but was later released and ran against John Connally for Governor of Texas.	#illuminati
id=illuminati-2329	22647	Mon 1 January 1962	01/01/1962	1962 AD.	Ruby allegedly flies from Mexico City to visit Havana.	#illuminati
id=illuminati-2332	22647	Mon 1 January 1962	01/01/1962	1962 AD.	Suicide of Marilyn Monroe under questionable circumstances.	#illuminati
id=illuminati-2335	22647	Mon 1 January 1962	01/01/1962	1962 AD.	UFOlogist Williamson disappears in South America.	#illuminati
id=illuminati-2338	22798	Fri 1 June 1962	01/06/1962	June 1 1962 AD.	The U.S. Embassy gave Oswald a repatriation loan of $435.71	#illuminati
id=illuminati-2341	23012	Tue 1 January 1963	01/01/1963	1963 AD.	Alleged assassination attempt of JFK in Miami but right-winger Milteer spills the beans; another attempt in Chicago also supposedly foiled.	#illuminati
id=illuminati-2344	23012	Tue 1 January 1963	01/01/1963	1963 AD.	Assassination of Sylvanus Olympio of Togo, Abdul Karim Kassem of Iraq, Medgar Evers of US, Ngo Dinh Diem of South Vietnam and John Kennedy of US; Texas Gov. John Connally wounded, police officer Tippit and Oswald killed.	#illuminati
id=illuminati-2347	23012	Tue 1 January 1963	01/01/1963	1963 AD.	Attempted assassination of Castro in which CIA agent Rorke is killed.	#illuminati
id=illuminati-2350	23012	Tue 1 January 1963	01/01/1963	1963 AD.	Attempted assassination of General Walker in Dallas earlier, allegedly by Oswald; Oswald also supposedly threatened to kill ex-Veep Nixon, or was it Veep Johnson? the Warren Commission wasn't sure.	#illuminati
id=illuminati-2353	23012	Tue 1 January 1963	01/01/1963	1963 AD.	Bilderberger meeting in Cannes, France.	#illuminati
id=illuminati-2356	23012	Tue 1 January 1963	01/01/1963	1963 AD.	CIA begins weather modification project over Hue, Vietnam.	#illuminati
id=illuminati-2359	23012	Tue 1 January 1963	01/01/1963	1963 AD.	Ecuadorian government overthrown.	#illuminati
id=illuminati-2362	23012	Tue 1 January 1963	01/01/1963	1963 AD.	Johnson becomes president; almost immediately reverses JFK's decision to withdraw from Vietnam.	#illuminati
id=illuminati-2365	23012	Tue 1 January 1963	01/01/1963	1963 AD.	Numerous MIB spotted in Dealy Plaza.	#illuminati
id=illuminati-2368	23012	Tue 1 January 1963	01/01/1963	1963 AD.	Profumo scandal in England, involving sex and spying, brings down Conservative government.	#illuminati
id=illuminati-2371	23012	Tue 1 January 1963	01/01/1963	1963 AD.	Russia sends first woman into space.	#illuminati
id=illuminati-2374	23012	Tue 1 January 1963	01/01/1963	1963 AD.	Unexplained radio transmission interrupts astronaut Gordon Cooper in unidentified language.	#illuminati
id=illuminati-2377	23377	Wed 1 January 1964	01/01/1964	1964 AD.	Assassination of Jigme P. Dorji of Bhutan.	#illuminati
id=illuminati-2380	23377	Wed 1 January 1964	01/01/1964	1964 AD.	Bilderberger meeting in Williamsburg, Virginia.	#illuminati
id=illuminati-2383	23377	Wed 1 January 1964	01/01/1964	1964 AD.	Congress passes the Tonkin Gulf resolution giving LBJ power to make war on Vietnam.	#illuminati
id=illuminati-2386	23377	Wed 1 January 1964	01/01/1964	1964 AD.	Death associated with Kennedy assassination: Betty Mooney MacDonald, former Carousel Club stripper who had met Oswald at a party and provided an alibi for Darrell Wayne Garner (who was accused of wounding Tippit - killing witness Warren Reynolds), found hanged in her cell after being arrested for fighting with her room-mate.	#illuminati
id=illuminati-2389	23377	Wed 1 January 1964	01/01/1964	1964 AD.	Death associated with Kennedy assassination: Bill Hunter, Long Beach Press-Telegram reporter, who had met with Ruby's room-mate George Senator and Ruby's attorney Tom Howard at Ruby's apartment a few hours after Oswald's murder, shot to death by a policeman in Long Beach, California, police station, accidentally.	#illuminati
id=illuminati-2392	23377	Wed 1 January 1964	01/01/1964	1964 AD.	Death associated with Kennedy assassination: Garner disappears, later found dead.	#illuminati
id=illuminati-2395	23377	Wed 1 January 1964	01/01/1964	1964 AD.	Death associated with Kennedy assassination: Gary Underhill, former Life editor and CIA agent who begged friends to protect him because he knew who killed Kennedy, found shot in left side of head - ruled suicide even though he was right-handed.	#illuminati
id=illuminati-2398	23377	Wed 1 January 1964	01/01/1964	1964 AD.	Death associated with Kennedy assassination: Hank Killam, whose wife Wanda was also a stripper at Ruby's club and who was a friend of John Carter who once lived in Oswald's rooming house, evades police for several months, then found with a slashed throat in Pensacola, Florida.	#illuminati
id=illuminati-2401	23377	Wed 1 January 1964	01/01/1964	1964 AD.	Death associated with Kennedy assassination: Jim Koethe, Dallas Times-Herald reporter also present at the meeting in Ruby's apartment, killed by karate chop to the throat as he emerged from the shower.	#illuminati
id=illuminati-2404	23377	Wed 1 January 1964	01/01/1964	1964 AD.	Death associated with Kennedy assassination: Mary Meyer, painter, niece of forester Gifford Pinchot and one of JFK's lovers (who allegedly funnelled LSD from an unsuspecting Timothy Leary to JFK), shot while taking a walk in Washington, D.C. - her secret diary confiscated by her CIA friend James Angleton, later allegedly destroyed.	#illuminati
id=illuminati-2407	23377	Wed 1 January 1964	01/01/1964	1964 AD.	Death associated with Kennedy assassination: Puerto Rican Teamster Ramon Ducos and Miguel Cruz who was allegedly arrested with Oswald in New Orleans and who claimed to have killed Kennedy; Chavez later killed by his bodyguard, Miguel Cruz.	#illuminati
id=illuminati-2410	23377	Wed 1 January 1964	01/01/1964	1964 AD.	Death associated with Kennedy assassination: Robert Kennedy allegedly stalked in assassination plot during his New York senatorial race by Frank Chavez, associate of Ruby.	#illuminati
id=illuminati-2413	23377	Wed 1 January 1964	01/01/1964	1964 AD.	Durham kills wife, terminated from Des Moines police.	#illuminati
id=illuminati-2416	23377	Wed 1 January 1964	01/01/1964	1964 AD.	Report of the Warren Commission on the Assassination of President Kennedy released; Commission finds that Oswald, acting alone, killed JFK.	#illuminati
id=illuminati-2419	23377	Wed 1 January 1964	01/01/1964	1964 AD.	Virginia Miller, later known as 'Blue Dove,' allegedly begins career as 'disrupter' in the Amerindian community; later serves as FBI informer on Indian activities.	#illuminati
id=illuminati-2422	23743	Fri 1 January 1965	01/01/1965	1965 AD.	Another ham radio operator, Sidney Padrick, makes contact with UFO aliens.	#illuminati
id=illuminati-2425	23743	Fri 1 January 1965	01/01/1965	1965 AD.	Assassination of Pierre Ngendandumwe of Burundi, Hassan Ali Mansour of Iran, Malcolm X of US and Mario Mendez Montenegro of Guatemala.	#illuminati
id=illuminati-2428	23743	Fri 1 January 1965	01/01/1965	1965 AD.	Bilderberger meeting in Lake Como, Italy.	#illuminati
id=illuminati-2431	23743	Fri 1 January 1965	01/01/1965	1965 AD.	California highway inspector Rex Heflin, who took pictures of UFOs, visited by MIB who took the original photographs and left; NORAD denies they were their men, as claimed.	#illuminati
id=illuminati-2434	23743	Fri 1 January 1965	01/01/1965	1965 AD.	Death associated with Kennedy assassination: Dorothy Kilgallen, columnist and TV panel-show figure who had a private half-hour interview with Ruby and said she was going to break the Kennedy case wide open, found dead in her apartment of an apparent overdose of alcohol and barbiturates.	#illuminati
id=illuminati-2437	23743	Fri 1 January 1965	01/01/1965	1965 AD.	Death associated with Kennedy assassination: Karen Bennett Carlin, another Carousel entertainer who reported seeing hate-ad signer Bernard Weissman at Ruby's club and was the last known person to speak to Ruby before he shot Oswald, died of gunshot wounds in the head in Houston.	#illuminati
id=illuminati-2440	23743	Fri 1 January 1965	01/01/1965	1965 AD.	Death associated with Kennedy assassination: Rose Cherami, another Carousel stripper who told a psychiatrist Kennedy had to be killed two days before it happened and who said she'd seen Oswald at Ruby's club many times, killed in a hit-and-run car accident near Big Sandy, Texas.	#illuminati
id=illuminati-2443	23743	Fri 1 January 1965	01/01/1965	1965 AD.	Death associated with Kennedy assassination: Tom Howard, Ruby's attorney who met with Senator and others after Oswald's death, died of a heart attack after 'acting strangely' for two days, no autopsy performed.	#illuminati
id=illuminati-2446	23743	Fri 1 January 1965	01/01/1965	1965 AD.	Death associated with Kennedy assassination: William Whaley, Dallas cab driver who took Oswald from the Book Depository to his rooming house after the assassination, killed in an auto accident - the first on-duty cabbie death in Dallas since 1937.	#illuminati
id=illuminati-2449	23743	Fri 1 January 1965	01/01/1965	1965 AD.	Durham involved in various Mafia activities and acts as informer for police, possibly CIA.	#illuminati
id=illuminati-2452	23743	Fri 1 January 1965	01/01/1965	1965 AD.	Early prison behaviour modification program, CASE, begins in Washington, D.C., boys school.	#illuminati
id=illuminati-2455	23743	Fri 1 January 1965	01/01/1965	1965 AD.	Fifth UFO flap year.	#illuminati
id=illuminati-2458	23743	Fri 1 January 1965	01/01/1965	1965 AD.	Fighting in Vietnam escalates into major war.	#illuminati
id=illuminati-2461	23743	Fri 1 January 1965	01/01/1965	1965 AD.	On the day Malcolm was killed, Pio Ghana de Pinto, who had been working with him to coordinate poor Americans and Third World Africans, was machine-gunned at his home in Africa.	#illuminati
id=illuminati-2464	23743	Fri 1 January 1965	01/01/1965	1965 AD.	Three Russian scientists report receiving unexplained signals from space.	#illuminati
id=illuminati-2467	23743	Fri 1 January 1965	01/01/1965	1965 AD.	US Army explores sites in the Middle East, for potential locations for nuclear devices intended to set off earthquakes.	#illuminati
id=illuminati-2470	24108	Sat 1 January 1966	01/01/1966	1966 AD.	Army simulated germ warfare project in New York City.	#illuminati
id=illuminati-2473	24108	Sat 1 January 1966	01/01/1966	1966 AD.	Assassination of J.T.V. Ironsi Aquiyi of Nigeria and Hendrick F. Verwoerd of South Africa.	#illuminati
id=illuminati-2476	24108	Sat 1 January 1966	01/01/1966	1966 AD.	Assassination of Sir Abubakar Balewa of Nigeria.	#illuminati
id=illuminati-2479	24108	Sat 1 January 1966	01/01/1966	1966 AD.	Attempted assassination of James Meredith in US.	#illuminati
id=illuminati-2482	24108	Sat 1 January 1966	01/01/1966	1966 AD.	Bilderberger meeting in Wiesbaden, Germany.	#illuminati
id=illuminati-2485	24108	Sat 1 January 1966	01/01/1966	1966 AD.	CIA begins weather modification experiments over Cuba, later used in an attempt to ruin Castro's sugar cane crop.	#illuminati
id=illuminati-2488	24108	Sat 1 January 1966	01/01/1966	1966 AD.	E. Howard Hunt serves as CIA contact in assassination plot against Castro.	#illuminati
id=illuminati-2491	24108	Sat 1 January 1966	01/01/1966	1966 AD.	Retired naval Lt. William Pitzer, who had photographed the secret JFK autopsy and was beginning a job with a TV station, found dead with a bullet in his head.	#illuminati
id=illuminati-2494	24473	Sun 1 January 1967	01/01/1967	1967 AD.	Approximate date La Costa Resort hotel built near San Clemente, California: meeting place of Mob figures, Teamsters, politicians and other big-wigs. 	#illuminati
id=illuminati-2497	24473	Sun 1 January 1967	01/01/1967	1967 AD.	Assassination of American Nazi George Lincoln Rockwell in Virginia.	#illuminati
