ID	Epoch Day	Weekday	Date	When	Event	Tag
id=illuminati-1075	-39444	Sun 1 January 1792	01/01/1792	1792 AD.	Louis XVI imprisoned in the Templars Temple tower.	#illuminati
id=illuminati-1078	-39444	Sun 1 January 1792	01/01/1792	1792 AD.	Massacres of September, in which priests, bishops and others are killed.	#illuminati
id=illuminati-1081	-39444	Sun 1 January 1792	01/01/1792	1792 AD.	War between France and Austria.	#illuminati
id=illuminati-1084	-39444	Sun 1 January 1792	01/01/1792	1792 AD.	Washington re-elected.	#illuminati
id=illuminati-1087	-39078	Tue 1 January 1793	01/01/1793	1793 AD.	France declares war on England and the Dutch United Provinces.	#illuminati
id=illuminati-1090	-39078	Tue 1 January 1793	01/01/1793	1793 AD.	French food riots.	#illuminati
id=illuminati-1093	-39078	Tue 1 January 1793	01/01/1793	1793 AD.	French government kills thousands of its citizens.	#illuminati
id=illuminati-1096	-39078	Tue 1 January 1793	01/01/1793	1793 AD.	Russia and Prussia begin partition of Poland.	#illuminati
id=illuminati-1099	-39078	Tue 1 January 1793	01/01/1793	1793 AD.	war breaks out with Spain and Austria.	#illuminati
id=illuminati-1102	-39078	Tue 1 January 1793	01/01/1793	1793 AD.	Year One of the French Republic; the year of the Terror, Louis XVI found guilty of conspiracy, condemned to be executed.	#illuminati
id=illuminati-1105	-38713	Wed 1 January 1794	01/01/1794	1794 AD.	attempts of Robespierre's life; his enemies accuse him of attempting to have himself declared divine by Catherine Theot, an old woman who preached a mystery religion; Robespierre guillotined.	#illuminati
id=illuminati-1108	-38713	Wed 1 January 1794	01/01/1794	1794 AD.	Monroe becomes minister to France.	#illuminati
id=illuminati-1111	-38713	Wed 1 January 1794	01/01/1794	1794 AD.	Whiskey rebellion in Pennsylvania to protest liquor taxes.	#illuminati
id=illuminati-1114	-38713	Wed 1 January 1794	01/01/1794	1794 AD.	Would-be assassin of Robespierre fires on Collot d'Herbois instead; the next day a young girl arrested as suspected assassin; she and 40 others sent to guillotine.	#illuminati
id=illuminati-1117	-38713	Wed 1 January 1794	01/01/1794	1794 AD.	Year Two; France passes laws distributing confiscated property to the poor, leads victorious battle against Austrians.	#illuminati
id=illuminati-1120	-38348	Thu 1 January 1795	01/01/1795	1795 AD.	France makes peace with Prussia and Spain, invades Holland.	#illuminati
id=illuminati-1123	-38348	Thu 1 January 1795	01/01/1795	1795 AD.	Napoleon suppresses revolt in Paris and goes to Italy as Commander-in-Chief.	#illuminati
id=illuminati-1126	-38348	Thu 1 January 1795	01/01/1795	1795 AD.	Yazoo land fraud: bribed Georgia legislators sell Mississippi.	#illuminati
id=illuminati-1129	-37983	Fri 1 January 1796	01/01/1796	1796 AD.	Adams elected President.	#illuminati
id=illuminati-1132	-37983	Fri 1 January 1796	01/01/1796	1796 AD.	Paine publishes letter critical of Washington.	#illuminati
id=illuminati-1135	-37252	Mon 1 January 1798	01/01/1798	1798 AD.	Illuminati scare in New England.	#illuminati
id=illuminati-1138	-37252	Mon 1 January 1798	01/01/1798	1798 AD.	Knights of Malta lose their island to Napoleon.	#illuminati
id=illuminati-1141	-36522	Wed 1 January 1800	01/01/1800	1800 AD.	Death of Thomas Waley, one of the last Hell Fire Club leaders.	#illuminati
id=illuminati-1144	-36522	Wed 1 January 1800	01/01/1800	1800 AD.	Napoleon comes to power, allegedly through Illuminati manipulation.	#illuminati
id=illuminati-1147	-34696	Tue 1 January 1805	01/01/1805	1805 to 1881 AD.	Life of Auguste Blanqui, French socialist, founder of numerous secret societies modelled after Buonarroti.	#illuminati
id=illuminati-1150	-31044	Sun 1 January 1815	01/01/1815	1815 AD.	Napoleon's Waterloo.	#illuminati
id=illuminati-1153	-31044	Sun 1 January 1815	01/01/1815	1815 AD.	Secret societies which eventually become the Decembrist Movement formed in Russian Masonic lodges.	#illuminati
id=illuminati-1156	-30313	Wed 1 January 1817	01/01/1817	1817 AD.	Irish immigrants force entry into Tammany Society, changing its direction.	#illuminati
id=illuminati-1159	-30313	Wed 1 January 1817	01/01/1817	1817 AD.	Suppression of the Lodge of Jupiter the Thunderer begins.	#illuminati
id=illuminati-1162	-29948	Thu 1 January 1818	01/01/1818	1818 AD.	Mary Shelley's Frankenstein published.	#illuminati
id=illuminati-1165	-29583	Fri 1 January 1819	01/01/1819	1819 AD.	American Independent Order of Odd Fellows founded.	#illuminati
id=illuminati-1168	-29583	Fri 1 January 1819	01/01/1819	1819 AD.	Founding of National Freemasonry, the most important of several Polish secret societies devoted to ousting the Russians from Poland.	#illuminati
id=illuminati-1171	-29583	Fri 1 January 1819	01/01/1819	1819 AD.	Liberation of Columbia by Bolivar.	#illuminati
id=illuminati-1174	-28487	Tue 1 January 1822	01/01/1822	1822 AD.	Ecuador liberated by Bolivar.	#illuminati
id=illuminati-1177	-28487	Tue 1 January 1822	01/01/1822	1822 AD.	Russian government suppresses Masonry.	#illuminati
id=illuminati-1180	-27391	Sat 1 January 1825	01/01/1825	1825 AD.	Bolivar liberates Bolivia.	#illuminati
id=illuminati-1183	-27391	Sat 1 January 1825	01/01/1825	1825 AD.	Decembrist movement suppressed in Russia after brief uprising.	#illuminati
id=illuminati-1186	-27391	Sat 1 January 1825	01/01/1825	1825 AD.	Founding of Vienna bank by Solmon Rothschild and Naples bank by Carl Rothschild.	#illuminati
id=illuminati-1189	-26296	Tue 1 January 1828	01/01/1828	1828 AD.	Anti-Masonic Party founded, first third-party in America.	#illuminati
id=illuminati-1192	-26296	Tue 1 January 1828	01/01/1828	1828 AD.	Attempted assassination of Bolivar.	#illuminati
id=illuminati-1195	-26296	Tue 1 January 1828	01/01/1828	1828 AD.	Tammany Society backs Andrew Jackson for President.	#illuminati
id=illuminati-1198	-25930	Thu 1 January 1829	01/01/1829	1829 AD.	Alleged Illuminati meeting in New York decides to unite Atheists and Nihilists into Communist movement.	#illuminati
id=illuminati-1201	-25565	Fri 1 January 1830	01/01/1830	1830 AD.	Anti-Masonic conventions in Massachusetts and Vermont find evidence linking Masonry with Illuminism.	#illuminati
id=illuminati-1204	-25565	Fri 1 January 1830	01/01/1830	1830 AD.	Book of Mormon published.	#illuminati
id=illuminati-1207	-25565	Fri 1 January 1830	01/01/1830	1830 AD.	Weishaupt and Bolivar die.	#illuminati
id=illuminati-1210	-25200	Sat 1 January 1831	01/01/1831	1831 AD.	Anti-Masonic Party runs Wirt for President, assuring that Mason Andrew Jackson would be re-elected.	#illuminati
id=illuminati-1213	-25200	Sat 1 January 1831	01/01/1831	1831 AD.	Poe dismissed from West Point.	#illuminati
id=illuminati-1216	-24469	Tue 1 January 1833	01/01/1833	1833 AD.	Jackson orders U.S. funds withdrawn from Bank of the United States, effectively killing the institution.	#illuminati
id=illuminati-1219	-23739	Thu 1 January 1835	01/01/1835	1835 AD.	Attempted assassination of Jackson with two single shot pistols, both of which jammed.	#illuminati
id=illuminati-1222	-23739	Thu 1 January 1835	01/01/1835	1835 AD.	Revolver invented.	#illuminati
id=illuminati-1225	-23739	Thu 1 January 1835	01/01/1835	1835 AD.	The socialist League of the Just founded in Paris, later becoming the Marxist Communist League.	#illuminati
id=illuminati-1228	-20452	Mon 1 January 1844	01/01/1844	1844 AD.	Bahai religion begins when the Bab proclaims his mission in Persia.	#illuminati
id=illuminati-1231	-20452	Mon 1 January 1844	01/01/1844	1844 AD.	Morse builds first practical telegraph.	#illuminati
id=illuminati-1234	-18991	Sat 1 January 1848	01/01/1848	1848 AD.	Abdication of Ferdinand I in Austria.	#illuminati
id=illuminati-1237	-18991	Sat 1 January 1848	01/01/1848	1848 AD.	Fall of monarchy in France.	#illuminati
id=illuminati-1240	-18991	Sat 1 January 1848	01/01/1848	1848 AD.	Fortean tidbits; moon turns 'blood-red' during total eclipse; a great comet fails to return at the time predicted; visions and 'phantom soldiers' seen in the skies of France and Scotland; Captain M'Quahae of H.M.S. Daedalus reports seeing a 'huge, unknown creature' in the ocean.	#illuminati
id=illuminati-1243	-18991	Sat 1 January 1848	01/01/1848	1848 AD.	Germany briefly united in a parliament at Frankfort; unity destroyed by the King of Prussia.	#illuminati
id=illuminati-1246	-18991	Sat 1 January 1848	01/01/1848	1848 AD.	Gold discovered in California.	#illuminati
id=illuminati-1249	-18991	Sat 1 January 1848	01/01/1848	1848 AD.	Marx and Engles publish the Communist Manifesto (allegedly commissioned by the Illuminati) and travel in France and Germany encouraging discontent with the Establishment.	#illuminati
id=illuminati-1252	-18991	Sat 1 January 1848	01/01/1848	1848 AD.	Republic established in Rome.	#illuminati
id=illuminati-1255	-18991	Sat 1 January 1848	01/01/1848	1848 AD.	Revolts in Denmark, Ireland, Lombardy, Schleswig-Holstein and Venice.	#illuminati
id=illuminati-1258	-18991	Sat 1 January 1848	01/01/1848	1848 AD.	Spiritualism born in Wayne County, New York, when the teenaged Fox sisters communicate with poltergeists.	#illuminati
id=illuminati-1261	-18991	Sat 1 January 1848	01/01/1848	1848 AD.	Woman's Suffrage Movement gets underway in Seneca Falls, New York.	#illuminati
id=illuminati-1264	-18625	Mon 1 January 1849	01/01/1849	1849 to 1936 AD.	Life of Sir Basil Zaharoff, 'mystery man of Europe,' who made a fortune as an armaments dealer and financier, selling weapons to both sides in World War I and other conflicts.	#illuminati
id=illuminati-1267	-17530	Thu 1 January 1852	01/01/1852	1852 AD.	Benjamin becomes first professed Jew elected to Congress.	#illuminati
id=illuminati-1270	-14973	Sat 1 January 1859	01/01/1859	1859 AD.	Darwin's Origin of Species published.	#illuminati
id=illuminati-1273	-14973	Sat 1 January 1859	01/01/1859	1859 AD.	Oil wells invented.	#illuminati
id=illuminati-1276	-14608	Sun 1 January 1860	01/01/1860	1860s AD.	Attempts to suppress the Mafia in Sicily are unsuccessful.	#illuminati
id=illuminati-1279	-14608	Sun 1 January 1860	01/01/1860	1860 AD.	Electric storage battery invented.	#illuminati
id=illuminati-1282	-14608	Sun 1 January 1860	01/01/1860	1860 AD.	Lincoln elected.	#illuminati
id=illuminati-1285	-14242	Tue 1 January 1861	01/01/1861	1861 AD.	American Civil War begins.	#illuminati
id=illuminati-1288	-14242	Tue 1 January 1861	01/01/1861	1861 AD.	Confederate states secede; elect Jefferson Davis president; Benjamin appointed Confederate Attorney General, later Secretary of War.	#illuminati
id=illuminati-1291	-14242	Tue 1 January 1861	01/01/1861	1861 AD.	Emancipation of serfs in Russia.	#illuminati
id=illuminati-1294	-14242	Tue 1 January 1861	01/01/1861	1861 AD.	Gatling gun patented.	#illuminati
id=illuminati-1297	-14242	Tue 1 January 1861	01/01/1861	1861 AD.	Jacolliot writes about the Nine Unknown in Calcutta.	#illuminati
id=illuminati-1300	-13877	Wed 1 January 1862	01/01/1862	1862 AD.	Benjamin appointed Confederate Secretary of State.	#illuminati
id=illuminati-1303	-13512	Thu 1 January 1863	01/01/1863	1863 AD.	Rockefeller builds his first refinery.	#illuminati
id=illuminati-1306	-13147	Fri 1 January 1864	01/01/1864	1864 AD.	David Farragut says 'Damn the torpedoes! Four bells! Captain Drayton, go ahead! Jouett, full speed!'	#illuminati
id=illuminati-1309	-12781	Sun 1 January 1865	01/01/1865	1865 AD.	American Civil War ends.	#illuminati
id=illuminati-1312	-12781	Sun 1 January 1865	01/01/1865	1865 AD.	Assassination of Lincoln; Andrew Johnson becomes president; 'Booth' killed; coded message found among his effects; the code key later found in possession of Benjamin, alleged Rothschild agent.	#illuminati
id=illuminati-1315	-12781	Sun 1 January 1865	01/01/1865	1865 AD.	Thirteenth amendment abolishes slavery.	#illuminati
id=illuminati-1318	-12416	Mon 1 January 1866	01/01/1866	1866 AD.	Benjamin flees to England.	#illuminati
id=illuminati-1321	-12416	Mon 1 January 1866	01/01/1866	1866 AD.	Death of Phineas Quimby, magnetic healer, founder of Free Thought movement, teacher of Mary Baker Eddy.	#illuminati
id=illuminati-1324	-12416	Mon 1 January 1866	01/01/1866	1866 AD.	Ku Klux Klan founded as a social club in Pulaski, Tennessee.	#illuminati
id=illuminati-1327	-12051	Tue 1 January 1867	01/01/1867	1867 AD.	Ku Klux Klan reorganized along political and racial lines near Nashville, Tennessee.	#illuminati
id=illuminati-1330	-11686	Wed 1 January 1868	01/01/1868	1868 AD.	Assassination of Thomas D'Arcy McGee, first Canadian political assassination.	#illuminati
id=illuminati-1333	-11320	Fri 1 January 1869	01/01/1869	1869 AD.	Mendeleev composes first periodic table of the elements in Russia.	#illuminati
id=illuminati-1336	-11320	Fri 1 January 1869	01/01/1869	1869 AD.	St. Germain allegedly completes 85 years in the Himalayas after his 'death.'	#illuminati
id=illuminati-1339	-11320	Fri 1 January 1869	01/01/1869	1869 AD.	U.S. transcontinental railroad completed.	#illuminati
id=illuminati-1342	-10955	Sat 1 January 1870	01/01/1870	1870 AD.	Standard Oil Company incorporated.	#illuminati
id=illuminati-1345	-9129	Fri 1 January 1875	01/01/1875	1875 AD.	'Whiskey Ring' conspiracy of distillery owners revealed.	#illuminati
id=illuminati-1348	-9129	Fri 1 January 1875	01/01/1875	1875 to 1947 AD.	Life of Aleister Crowley, the Great Beast, Golden Dawn leader and occult figure.	#illuminati
id=illuminati-1351	-9129	Fri 1 January 1875	01/01/1875	1875 AD.	Madam Blavatsky founds Theosophy Society.	#illuminati
id=illuminati-1354	-9129	Fri 1 January 1875	01/01/1875	1875 AD.	Mary Baker Eddy's Science and Health published.	#illuminati
id=illuminati-1357	-8764	Sat 1 January 1876	01/01/1876	1876 AD.	Battle of the Little Big Horn.	#illuminati
id=illuminati-1360	-8764	Sat 1 January 1876	01/01/1876	1876 AD.	Bell patents telephone.	#illuminati
id=illuminati-1363	-8764	Sat 1 January 1876	01/01/1876	1876 AD.	Disraeli again warns about dangers of secret societies.	#illuminati
id=illuminati-1366	-8764	Sat 1 January 1876	01/01/1876	1876 AD.	Otto builds four-cycle gasoline engine.	#illuminati
id=illuminati-1369	-8398	Mon 1 January 1877	01/01/1877	1877 AD.	First of seven wills in which Cecil Rhodes leaves his money to establish a secret society to expand British rule throughout the world.	#illuminati
id=illuminati-1372	-8033	Tue 1 January 1878	01/01/1878	1878 to 1945 AD.	Life of Edgar Cayce, visionary, trance-channeler who spoke of reincarnation, Egyptian mysteries, and Atlantis.	#illuminati
id=illuminati-1375	-6937	Sat 1 January 1881	01/01/1881	1881 AD.	Czar Alexander II assassinated by secret society.	#illuminati
id=illuminati-1378	-6937	Sat 1 January 1881	01/01/1881	1881 AD.	Disraeli publishes Lothair, a novel about secret societies and European politics.	#illuminati
id=illuminati-1381	-6937	Sat 1 January 1881	01/01/1881	1881 AD.	Garfield assassinated.	#illuminati
id=illuminati-1384	-5842	Tue 1 January 1884	01/01/1884	1884 AD.	Fabian Society founded in London by Sidney and Beatrice Webb and others.	#illuminati
id=illuminati-1387	-5476	Thu 1 January 1885	01/01/1885	1885 AD.	First practical horseless carriage built by Daimler.	#illuminati
id=illuminati-1390	-4746	Sat 1 January 1887	01/01/1887	1887 AD.	Golden Dawn founded in London by Mathers and others.	#illuminati
id=illuminati-1393	-4746	Sat 1 January 1887	01/01/1887	1887 AD.	Michaelson-Morley experiment disproving ether theory.	#illuminati
id=illuminati-1396	-4381	Sun 1 January 1888	01/01/1888	1888 AD.	Unsolved murders of London prostitutes by 'Jack the Ripper,' suspected of being one of those implicated in the Cleveland Street Affair involving high-society Victorians and their patronage of a brothel staffed by messenger boys.	#illuminati
id=illuminati-1399	-4015	Tue 1 January 1889	01/01/1889	1889 AD.	Second Communist International organized.	#illuminati
id=illuminati-1402	-3650	Wed 1 January 1890	01/01/1890	1890 AD.	Biologist Yersin visits India, purportedly to receive plague and cholera serum from the Nine Unknown.	#illuminati
id=illuminati-1405	-3650	Wed 1 January 1890	01/01/1890	1890 AD.	Wounded Knee massacre.	#illuminati
id=illuminati-1408	-3285	Thu 1 January 1891	01/01/1891	1891 AD.	Nikola Tesla invents Tesla coil, becomes U.S. citizen.	#illuminati
id=illuminati-1411	-3285	Thu 1 January 1891	01/01/1891	1891 AD.	Rhodes gains control of 90% of world's diamond supply.	#illuminati
id=illuminati-1414	-3285	Thu 1 January 1891	01/01/1891	1891 AD.	Rockefeller grant founds University of Chicago.	#illuminati
id=illuminati-1417	-3285	Thu 1 January 1891	01/01/1891	1891 AD.	The Round Tables, a secret society allegedly funded by Rhodes and the Rothschild's to gain financial and political power, founded in the U.S., Canada, Australia, India, South Africa and New Zealand.	#illuminati
id=illuminati-1420	-2920	Fri 1 January 1892	01/01/1892	1892 AD.	Rockefeller trust transferred to holding company: Standard Oil of New Jersey.	#illuminati
id=illuminati-1423	-2554	Sun 1 January 1893	01/01/1893	1893 AD.	Assassination of Chicago Mayor Harrison.	#illuminati
id=illuminati-1426	-2189	Mon 1 January 1894	01/01/1894	1894 AD.	Assassination of President Carnot of France.	#illuminati
id=illuminati-1429	-1459	Wed 1 January 1896	01/01/1896	1896 AD.	First 'flap year' for UFOs; wave of sightings of unidentified airships in U.S.	#illuminati
id=illuminati-1432	-1459	Wed 1 January 1896	01/01/1896	1896 AD.	Marconi's patent No. 7777 for radio.	#illuminati
id=illuminati-1435	-1093	Fri 1 January 1897	01/01/1897	1897 AD.	Assassination of Premier Canovas of Spain.	#illuminati
id=illuminati-1438	-1093	Fri 1 January 1897	01/01/1897	1897 AD.	Zionism founded in Basil, Switzerland by Theodore Herzl.	#illuminati
id=illuminati-1441	-728	Sat 1 January 1898	01/01/1898	1898 AD.	Assassination of Empress Elizabeth of Austria.	#illuminati
id=illuminati-1444	-728	Sat 1 January 1898	01/01/1898	1898 AD.	Pavlov begins study of conditioned reflex in dogs.	#illuminati
id=illuminati-1447	-363	Sun 1 January 1899	01/01/1899	1899 AD.	Alleged meeting in England at which the Morgan's, Rothschild's and Warburg's become affiliated.	#illuminati
id=illuminati-1450	-363	Sun 1 January 1899	01/01/1899	1899 AD.	Tesla discovers terrestrial stationary waves which can produce electricity; reports receiving signals from another planet.	#illuminati
id=illuminati-1453	2	Mon 1 January 1900	01/01/1900	1900 AD.	Approximate date Adolf Lanz founded the Order of New Templars, a fore-runner of the Nazi mentality.	#illuminati
id=illuminati-1456	2	Mon 1 January 1900	01/01/1900	1900 AD.	Assassination of King Umberto I of Italy and Kentucky Governor-elect William Goebel.	#illuminati
id=illuminati-1459	2	Mon 1 January 1900	01/01/1900	1900 AD.	Boxer rebellion in China.	#illuminati
id=illuminati-1462	2	Mon 1 January 1900	01/01/1900	1900 AD.	Tesla suggests alien beings might be living 'in the very midst of us.'	#illuminati
id=illuminati-1465	367	Tue 1 January 1901	01/01/1901	1901 AD.	Assassination of McKinley and Russian Education Minister Bogolepov.	#illuminati
id=illuminati-1468	367	Tue 1 January 1901	01/01/1901	1901 AD.	First trans-Atlantic radio broadcast: Marconi sends the letter S.	#illuminati
id=illuminati-1471	367	Tue 1 January 1901	01/01/1901	1901 AD.	Rockefeller Institute for Medical Research (Rockefeller University) founded in New York.	#illuminati
id=illuminati-1474	732	Wed 1 January 1902	01/01/1902	1902 AD.	Assassination of Russian Minister of Interior Sipyagain.	#illuminati
id=illuminati-1477	732	Wed 1 January 1902	01/01/1902	1902 AD.	Paul and Felix Warburg immigrate from Germany to the U.S. Rockefeller General Education Board founded.	#illuminati
id=illuminati-1480	1097	Thu 1 January 1903	01/01/1903	1903 AD.	Assassination of Bogdanovich, Governor of Ufa.	#illuminati
id=illuminati-1483	1097	Thu 1 January 1903	01/01/1903	1903 AD.	Protocols of Elders of Zion, alleged plan for Jewish world takeover, published in Russian newspaper.	#illuminati
id=illuminati-1486	1462	Fri 1 January 1904	01/01/1904	1904 AD.	Assassination of Russian Premier Vischelev von Plehev.	#illuminati
id=illuminati-1489	1828	Sun 1 January 1905	01/01/1905	1905 AD.	Abortive revolution in Russia.	#illuminati
id=illuminati-1492	1828	Sun 1 January 1905	01/01/1905	1905 AD.	Assassination of Grand Duke Sergius and Idaho Governor Steunenberg.	#illuminati
id=illuminati-1495	1828	Sun 1 January 1905	01/01/1905	1905 AD.	Expanded version of Protocols of Zion published.	#illuminati
id=illuminati-1498	2193	Mon 1 January 1906	01/01/1906	1906 AD.	Assassination of Russian General Dubrassov.	#illuminati
id=illuminati-1501	2558	Tue 1 January 1907	01/01/1907	1907 AD.	Financial panic and depression allegedly caused by J.P. Morgan to gain support for the central bank concept.	#illuminati
id=illuminati-1504	2923	Wed 1 January 1908	01/01/1908	1908 AD.	Assassination of King Carl of Prussia and Crown Prince of Portugal.	#illuminati
id=illuminati-1507	2923	Wed 1 January 1908	01/01/1908	1908 AD.	FBI founded.	#illuminati
id=illuminati-1510	2923	Wed 1 January 1908	01/01/1908	1908 AD.	Founding of the Armanen Initiates, another pro-Nazi secret society.	#illuminati
id=illuminati-1513	3654	Sat 1 January 1910	01/01/1910	1910 AD.	Attempted assassination of Mayor Gaynor of NYC.	#illuminati
id=illuminati-1516	3654	Sat 1 January 1910	01/01/1910	1910 AD.	Secret meeting of bankers and politicians at Jekyll Island, Georgia, results in Federal Reserve Act.	#illuminati
id=illuminati-1519	4019	Sun 1 January 1911	01/01/1911	1911 AD.	Assassination of Prime Minister Staliapin of Russia by police double agent.	#illuminati
id=illuminati-1522	4019	Sun 1 January 1911	01/01/1911	1911 AD.	Standard Oil of New Jersey broken up as illegal monopoly.	#illuminati
id=illuminati-1525	4019	Sun 1 January 1911	01/01/1911	Chartered 1911 AD.	The Hoher Armanen Orden (High Armanen Order) was the inner college of the Guido von List Society; its design was a magical order to proliferate List’s deeper runic-based initiations. 	#illuminati
id=illuminati-1528	4384	Mon 1 January 1912	01/01/1912	1912 AD.	Attempted assassination of Teddy Roosevelt.	#illuminati
id=illuminati-1531	4384	Mon 1 January 1912	01/01/1912	1912 AD.	Colonel E.M. House, adviser to Woodrow Wilson, publishes Philip Dru: Administrator, a political romance which proposed modern social legislation.	#illuminati
id=illuminati-1534	4384	Mon 1 January 1912	01/01/1912	1912 AD.	Founding of Germanen Order, another pre-Nazi secret society.	#illuminati
id=illuminati-1537	4700	Tue 12 November 1912	12/11/1912	November 12, 1912, AD.	Assassination of prime minister, José Canalejas y Méndez, of Spain.	#illuminati
id=illuminati-1540	4750	Wed 1 January 1913	01/01/1913	1913 AD.	Assassination of George I of Greece.	#illuminati
id=illuminati-1543	4750	Wed 1 January 1913	01/01/1913	1913 AD.	Rockefeller Foundation founded.	#illuminati
id=illuminati-1546	5115	Thu 1 January 1914	01/01/1914	28 June 1914 AD.	Archduke Franz Ferdinand and his wife were assassinated in Sarajevo by the 19-year-old Gavrilo Princip, a member of 'Young Bosnia'.	#illuminati
id=illuminati-1549	5115	Thu 1 January 1914	01/01/1914	28 June 1914 AD.	Attempted assassination of Archduke Ferdinand of Austria by Masonic agents, followed an hour later by successful assassination; in Russia, Rasputin stabbed the same day.	#illuminati
id=illuminati-1552	5115	Thu 1 January 1914	01/01/1914	28 June 1914 AD.	The first attempt on Rasputin's life, when he was stabbed in the abdomen by Chionya Gusyeva in his home village of Pokrovskoye in Siberia, Russia: He survived the attempt.	#illuminati
id=illuminati-1555	5115	Thu 1 January 1914	01/01/1914	28 June 1914 AD.	World War I begins.	#illuminati
id=illuminati-1558	5480	Fri 1 January 1915	01/01/1915	1915 AD.	Alfred Wegener proposed theory of continental drift, receives ridicule and contempt from his fellow scientists.	#illuminati
id=illuminati-1561	5480	Fri 1 January 1915	01/01/1915	1915 AD.	Ku Klux Klan revived.	#illuminati
id=illuminati-1564	5480	Fri 1 January 1915	01/01/1915	1915 AD.	Sinking of the Lusitania by German submarine; allegedly carrying secret munitions for the Allies, the ship supposedly sacrificed by British and American authorities to drum up war hysteria in U.S.	#illuminati
id=illuminati-1567	5845	Sat 1 January 1916	01/01/1916	1916 AD.	Assassination of Rasputin.	#illuminati
id=illuminati-1570	6211	Mon 1 January 1917	01/01/1917	1917 AD.	Russian Revolution begins; Cheka, secret police of Bolsheviks, founded.	#illuminati
id=illuminati-1573	6211	Mon 1 January 1917	01/01/1917	1917 AD.	United States enters World War I.	#illuminati
id=illuminati-1576	6576	Tue 1 January 1918	01/01/1918	1918 AD.	Assassination of Russian Czar Nicholas II and his family.	#illuminati
id=illuminati-1579	6576	Tue 1 January 1918	01/01/1918	1918 AD.	Attempted assassination of Lenin.	#illuminati
id=illuminati-1582	6576	Tue 1 January 1918	01/01/1918	1918 AD.	New Thought lecturer David Van Bush hires H.P. Lovecraft as a ghost writer.	#illuminati
id=illuminati-1585	6941	Wed 1 January 1919	01/01/1919	1919 AD.	Charles Fort's The Book of the Damned published.	#illuminati
id=illuminati-1588	6941	Wed 1 January 1919	01/01/1919	1919 AD.	Founding of Thule Society in Germany; Hitler recruited.	#illuminati
id=illuminati-1591	6941	Wed 1 January 1919	01/01/1919	1919 AD.	Freud draws attention to Austrian neurologist Poetzl's experiments with the tachistroscope, an early device for studying subliminal perception.	#illuminati
id=illuminati-1594	6941	Wed 1 January 1919	01/01/1919	1919 AD.	Hitler joins the German Workers' Party.	#illuminati
id=illuminati-1597	6941	Wed 1 January 1919	01/01/1919	1919 AD.	League of Nations founded at Paris Peace Conference.	#illuminati
id=illuminati-1600	6941	Wed 1 January 1919	01/01/1919	1919 AD.	Meeting at the Majestic Hotel, Paris, between Wilsonian intellectuals (House, Dulles and Dulles, etc.) and 'like-minded Englishmen' to discuss forming an organization 'for the study of international affairs.'	#illuminati
id=illuminati-1603	6941	Wed 1 January 1919	01/01/1919	1919 AD.	Royal Institute of International Affairs founded.	#illuminati
